{"$schema":"https://json-schema.org/draft/2020-12/schema","$id":"https://schemas.technical-debt-engine.dev/configuration/1.0.0/schema.json","type":"object","required":["schemaVersion"],"properties":{"schemaVersion":{"const":"1.0.0"},"capabilities":{"type":"array","items":{"type":"string"}},"adapterPreferences":{"type":"object"},"analyzers":{"type":"object"},"thresholds":{"type":"object"},"exclusions":{"type":"array","items":{"type":"string"}},"generatedPaths":{"type":"array","items":{"type":"string"}},"vendorPaths":{"type":"array","items":{"type":"string"}},"reportFormats":{"type":"array","items":{"enum":["json","markdown","sarif"]}},"qualificationPolicy":{"type":"string"},"baseline":{"type":"string"},"suppressions":{"type":"array","items":{"$ref":"#/$defs/suppression"}},"pathRedaction":{"type":"boolean"},"executionLimits":{"type":"object"}},"$defs":{"suppression":{"type":"object","required":["id","scope","reason","owner","createdAt","policyReference"],"properties":{"id":{"type":"string"},"scope":{"type":"string"},"reason":{"type":"string"},"owner":{"type":"string"},"createdAt":{"type":"string"},"expiresAt":{"type":"string"},"policyReference":{"type":"string"},"candidateScope":{"type":"string"},"compensatingControl":{"type":"string"}}}},"additionalProperties":false}
